{
  "schema": 2,
  "pattern": {
    "id": "explicit-passes",
    "title": "Explicit passes",
    "version": "1.0.0",
    "author": "graphghan fixtures",
    "license": "MIT"
  },
  "chart": {
    "id": "sha256:2ae29453a3876103b4a7150767beb9d13afeb8a88e97d9cae86a9cedc6f17e34",
    "variant": "final",
    "gauge_key": "sc",
    "width": 4,
    "height": 2
  },
  "generator": {
    "name": "graphghan-fixtures",
    "version": "1"
  },
  "palette": [
    {
      "code": "A",
      "name": "Color A",
      "hex": "#000000"
    },
    {
      "code": "B",
      "name": "Color B",
      "hex": "#ffffff"
    }
  ],
  "rows": [
    "2A2B",
    "4A"
  ],
  "gauge": {
    "stitches": 14.0,
    "rows": 16.0,
    "over": {
      "value": 4,
      "unit": "in"
    },
    "stitch": "sc"
  },
  "technique": {
    "type": "none"
  },
  "instructions": [],
  "passes": [
    {
      "label": "Row 1",
      "side": "RS",
      "direction": "ltr",
      "grid_row": 0,
      "runs": [
        {
          "code": "A",
          "count": 2,
          "x0": 0
        },
        {
          "code": "B",
          "count": 2,
          "x0": 2
        }
      ]
    },
    {
      "label": "Row 2",
      "side": "RS",
      "direction": "ltr",
      "grid_row": 1,
      "runs": [
        {
          "code": "A",
          "count": 4,
          "x0": 0
        }
      ]
    }
  ]
}
