{"chart":{"height":5,"id":"sha256:98967271a405be50e162187b5b7839e8334b346ec160848ab488fda8be67a9a9","width":7},"ext":{"graphghan":{"import":{"check":"finished","gauge_printed":false,"grid":true,"rows_checked":5,"rows_disagree":[],"rows_total":5,"rows_unread":0,"source":"pdf"}}},"gauge":{"over":{"unit":"in","value":4},"rows":16,"stitch":"sc","stitches":14},"generator":{"name":"graphghan-ios","version":"0.1.0"},"palette":[{"code":"A","hex":"#201b18","name":"black"},{"code":"B","hex":"#ffffff","name":"white"},{"code":"N","hex":"#a4dade","name":"light blue","stitch":false,"use":"no stitch"}],"pattern":{"id":"phone-pieced","title":"Phone pieced","version":"1.0.0"},"rows":["2N3A2N","1N2A1B3A","3A1B3A","1N5A1N","2N3A2N"],"schema":3,"technique":{"first_side":"RS","rs_direction":"rtl","start":"bottom","turn":true,"type":"rows"},"written":["Row 1: 3 black","Row 2: 5 black","Row 3: 3 black, 1 white, 3 black","Row 4: 2 black, 1 white, 3 black","Row 5: 3 black"]}
